{
  "version": 2,
  "updated_at": "2026-10-13T01:06:00+00:00",
  "repos": [
    {
      "name": "analytics-service-toolkit",
      "owner": "nassim0014",
      "visibility": "public",
      "in_rotation": true,
      "role": "rotation",
      "created_by": "genesis-loop",
      "notes": "New to the registry as of 2026-08-21 — no prior-cycle notes yet. Read CLAUDE.md/README.md/docs/IMPROVEMENTS.md fresh. | Import-only shared toolkit consumed by other KINZ services — treat its public module surface as a contract; breaking changes ripple to sibling repos. | FLAG 2026-09-13 (closed-loop registry refresh): visibility found PUBLIC on GitHub, was recorded private as of 2026-09-10. This loop did not change it and does not know who/what did. Never fixed/reverted by this loop (visibility changes are owner-only) — surfaced in the run report for owner review. | 2026-09-27 (cloud-maintenance): quiet run, no open PRs, main green. | 2026-10-02 (cloud-maintenance): quiet run, no open PRs (dependabot or agent), main green (latest CI run #15 on commit 202f27b passed), ci.yml already runs on both push and pull_request so no new workflow needed. No action taken. Public visibility (previously flagged 2026-09-13) unchanged -- still an owner-only decision, not re-verified this run since no GitHub visibility-check tool was used, but nothing suggests it changed. | 2026-10-02 (cloud-improvements): worked backlog item 5 (Postgres-backed Deduplicator), split into 5a (library code -- done, PR #8, merged) and 5b (CI Postgres service-container wiring -- deferred, needs a .github/workflows/ edit this loop's merge rules keep as a separate owner-reviewed change, and there's no Postgres available in-sandbox to verify it against). PR #8 added a DedupBackend protocol, InMemoryDedupBackend, PostgresDedupBackend (atomic claim via INSERT ... ON CONFLICT ... RETURNING), and create_dedup_table; Deduplicator(ttl_s=...) stays backward-compatible. 15 new tests, coverage 91%->92%, ruff clean. CI (3.11/3.12) finished green after the subagent's run ended; the dispatcher polled it to completion and merged (sha 2c7df90). Next open items: 6 (astk doctor schema checks), 7 (repo hygiene parity), 8/9 (coverage-gap items), plus 4b and 5b (explicitly owner/future-cycle). | 2026-10-03 (cloud-maintenance): Checked fresh -- zero open PRs (dependabot or agent), nothing to merge/fix/close. Default branch main is green on CI run #20. Confirmed ci.yml already runs on both push and pull_request events (ruff + pytest, py3.11/3.12), so rule 5's new-workflow requirement is already satisfied and untouched. No action taken this cycle; item 5b (Postgres CI wiring, needs a workflow-file edit) remains deliberately deferred per prior run's note. | 2026-10-04 (cloud-maintenance): Checked fresh — zero open PRs (dependabot or agent), nothing to merge/fix/close. Default branch main is green on CI run 36998283384 (head 36e3f31, matches branch tip). Confirmed .github/workflows/ still contains only ci.yml, already running on both push and pull_request (ruff + pytest), so rule 5's new-workflow requirement remains satisfied and untouched. No action taken this cycle; deferred items 5b (Postgres CI service-container wiring) and others from 2026-10-02's cloud-improvements run remain open for a future cycle. | 2026-10-08 (cloud-maintenance): quiet run, zero open PRs, main CI green on run #20. ci.yml already covers push and pull_request so no workflow gap. Re-confirmed visibility still PUBLIC (unchanged since 2026-09-13 flag), owner-only decision, not touched. No action taken. | 2026-10-08 (cloud-daily-commit): no nassim0014 commit landed today, so added 3 tests for the previously-uncovered astk query CLI command (table/json/csv formats) -- closes the coverage gap in cli.py noted in #7. CI green (3.11/3.12), merged (PR #10, squash). cli.py coverage 80%->94%. | 2026-10-09 (cloud-maintenance): quiet run, zero open PRs, main CI green (run #22, success). | 2026-10-10 (cloud-creative): added astk demo, a zero-config/zero-secret CLI command exercising settings+db+alerts+dedup+logging end to end against in-memory SQLite (PR #11, merged). Judge subagent caught the demo settings subclass had silently widened slack_webhook_url from SecretStr to plain str -- fixed before merge, kept the real SecretStr type and added a dry-run SlackNotifier check for the unwrap-for-use path. 84 tests passing (was 77), ruff clean on 3.11/3.12. | 2026-10-12 (cloud-maintenance): zero open PRs, main green (run #25 success), ci.yml still covers push+pull_request — no action needed. | 2026-10-13 (cloud-maintenance): quiet run, zero open PRs, main green (CI #25, run id 38012991802, success), ci.yml confirmed already covers both push and pull_request. No action taken.",
      "pushed_at": "2026-09-12T11:52:18Z",
      "primary_language": "Python",
      "is_archived": false,
      "worked_by": "claude"
    },
    {
      "name": "btc-llm-sentiment",
      "owner": "nassim0014",
      "visibility": "public",
      "in_rotation": true,
      "role": "rotation",
      "created_by": "manual",